ID,Topic,RawContent,Platforms,MediaURL,BestTimeSlot,Tone,BrandVoice,Hashtags,Status,PostURL,PostID,PostedAt
POST_001,AI Automation saves 10 hours/week,"Key points: 1) Automate email responses 2) Schedule social media 3) Auto-generate reports 4) Sync CRM data. Real result: our team saved 40hrs/month.",linkedin;instagram;twitter,https://res.cloudinary.com/demo/image/upload/sample.jpg,9,professional,"We are a tech startup making AI automation accessible to every business.","#AIAutomation #Productivity #n8n",Ready,,,
POST_002,Why n8n beats Zapier for developers,"Technical comparison: 1) Open source 2) Self-hosted option 3) Code nodes 4) No per-task pricing 5) Better for complex flows",linkedin;twitter,,10,technical,"We are a tech startup making AI automation accessible to every business.","#n8n #Zapier #Automation #NoCode",Ready,,,
POST_003,Behind the scenes: Our automation stack,"Here's exactly what we use to run our entire business on automation: n8n for workflows, GPT-4 for content, Airtable for data, Make for simple tasks",instagram;facebook,https://res.cloudinary.com/demo/image/upload/sample.jpg,19,casual,"We are a tech startup making AI automation accessible to every business.","#BehindTheScenes #Startup #AI",Ready,,,
POST_004,5 n8n workflows every startup needs,"1) Lead capture & CRM sync 2) Social media posting 3) Invoice automation 4) Customer onboarding 5) Weekly reporting",linkedin;instagram;twitter;facebook,,14,professional,"We are a tech startup making AI automation accessible to every business.","#Startup #Automation #Productivity",Ready,,,
POST_005,How we grew to 10K followers using AI content,"Full breakdown: AI writes 80% of our captions, we edit 20%. Posted 3x/week on LinkedIn, 1x/day Instagram. Engagement up 300% in 60 days.",linkedin;instagram,,17,inspirational,"We are a tech startup making AI automation accessible to every business.","#GrowthHacking #ContentStrategy #AI",Scheduled,,,
